{
  "contract_version": "0.1.0-frozen",
  "thesis_id": "THESIS_DEMO_001",
  "project_id": "PROJ_DEMO",
  "version_id": "THESIS_VER_001",
  "parent_version_id": null,
  "raw_claim": "美国财政扩张正在持续推高10年期美债收益率。",
  "normalized_claim": "美国财政供给扩张对10年期美债收益率存在持续正向因果影响。",
  "as_of_date": "2026-08-04",
  "language_level": "CAUSAL",
  "scope": {
    "subject": "US fiscal supply and 10-year Treasury yield",
    "geography": "United States",
    "start_date": null,
    "end_date": "2026-08-04",
    "horizon_text": "持续，尚未定义"
  },
  "definitions": [
    {
      "term": "财政扩张",
      "definition": null,
      "status": "AMBIGUOUS",
      "source_refs": []
    },
    {
      "term": "持续",
      "definition": null,
      "status": "MISSING",
      "source_refs": []
    }
  ],
  "required_evidence_types": [
    "CAUSAL_IDENTIFIED"
  ],
  "falsifier_requirements": [
    "加入货币条件后关系明显消失",
    "替换财政供给定义后方向不稳定",
    "不同估计窗口下结果不稳健"
  ],
  "input_object_refs": [
    {
      "contract_version": "0.1.0-frozen",
      "object_id": "DATA_US_TREASURY_10Y",
      "version_id": "VER_DEMO_20260804",
      "object_type": "DATASET",
      "name": "10-year Treasury yield demo snapshot",
      "representation": "PARQUET",
      "schema_version": "1.0.0",
      "content_hash": "0000000000000000000000000000000000000000000000000000000000000000",
      "license_policy": "PUBLIC",
      "access_scope": "WORKSPACE:WS_DEMO",
      "content_uri": "objects/DATA_US_TREASURY_10Y/VER_DEMO_20260804/data.parquet",
      "as_of_date": "2026-08-04",
      "data_schema": {
        "time_key": "date",
        "entity_keys": [],
        "value_fields": [
          "ust10"
        ],
        "frequency": "D",
        "units": {
          "ust10": "percent"
        },
        "field_types": {
          "date": "date",
          "ust10": "float64"
        }
      },
      "lineage_refs": [
        "SRC_PUBLIC_DEMO"
      ],
      "metadata": {
        "fixture_only": true
      }
    }
  ],
  "metadata": {
    "fixture_only": true
  }
}
